Harga Handphone HP OPPO Terbaru | Januari 2019,Daftar Harga Handphone HP OPPO Terbaru Januari 2019,(Januari 2019) Daftar harga Handphone HP OPPO baru & bekas termurah di Indonesia. Bandingkan harga dan spesifikasi Handphone HP OPPO Realme, OPPO Find , OPPO Neo.
Harga Handphone HP Murah Terbaru | Januari 2019,Daftar Harga Handphone HP Murah Terbaru Januari 2019,(Januari) (2019) Daftar harga Handphone HP baru & bekas termurah, bandingkan harga dari Advan, Apple, ASUS
Harga Handphone HP OPPO Find Terbaru | Januari 2019,Daftar Harga Handphone HP OPPO Find Terbaru Januari 2019,(Januari 2019) Daftar harga Handphone HP OPPO [Find] baru & bekas termurah, bandingkan harga OPPO Find X, OPPO Find 9, OPPO Find 5 Mini
Harga OPPO Find X Murah Terbaru & Spesifikasi,Harga OPPO Find X Murah Terbaru & Spesifikasi | iPrice,(Juni 2018) Daftar harga OPPO Find X baru & bekas termurah. Lihat spesifikasi OPPO Find X, review, warna & pilihan handphone OPPO lainnya di iPrice
Harga Sepatu di Indonesia,Jual Sepatu Model Terbaru,Harga sepatu di Indonesia, cek diskon dan penawarannya!
Sneaker Pria,Sneaker Pria di Indonesia | Harga Jual Sneaker Online,Beli Sneaker Pria | Gratis Ongkir | Garansi Resmi Toko | Bayar di Tempat (COD)
Sneaker Pria,Sneaker Pria di Indonesia | Harga Jual Sneaker Online,Beli Sneaker Pria | Gratis Ongkir | Garansi Resmi Toko | Bayar di Tempat (COD)
Harga produk Apple Terbaru Januari 2019,Daftar Harga produk Apple Terbaru Januari 2019,(Januari 2019) Daftar harga produk Apple baru & bekas termurah di Indonesia. Bandingkan harga dan spesifikasi Handphone & Tablet, Komputer dan Audio & Hi-Fi Apple.

Apple Price in Malaysia for January, 2019,Apple Price in Malaysia | Harga January, 2019,Find the best Apple price in Malaysia 2019. Compare different specifications, latest review, top models, and more at iPrice. Get discounts, free shipping, fast delivery, and cash-on-delivery.
Apple Phones & Tablets Price in Malaysia for January, 2019,Apple Phones & Tablets Price in Malaysia | Harga January, 2019,[January, 2019] Apple Phones & Tablets price in Malaysia starts from RM 11.00. Find the best Apple Phones & Tablets price in Malaysia, compare different specifications, latest review, top models, and more at iPrice. 
Apple Watch Phones & Tablets Price in Malaysia for January, 2019,Harga Apple Watch Phones & Tablets Price in Malaysia | Harga January, 2019,[January, 2019] Apple Watch Phones & Tablets price in Malaysia starts from RM 415.60. Find the best Apple Watch Phones & Tablets price in Malaysia, compare different specifications, latest review, top models, and more at iPrice. 
Apple Watch Series 3 price in Malaysia & Specs for January, 2019,Apple Watch 3 Price in Malaysia | Harga Apple Watch 3,Compare Apple Watch 3 (2018) Prices in Malaysia from different online stores like Lazada, Shopee and Harvey Norman. Check the features, latest expert reviews, variants & specs of Apple Watch 3.
Watches,Watch Price in Malaysia | Online Watch Shop Malaysia,Get the lowest price ❤️ on Ohtsuka Watch, Mens Watches, Rosefield Watches, cheap watches on sale, and more | ✅ Enjoy online shopping and buy Watches Online in Malaysia
Watches for Men,Watches for Men | The best prices online in Malaysia | iPrice,Buy the newest Watches for Men with the latest sales & promotions ★ Find cheap offers ★ Browse our wide selection of products
Watches,Watch Price in Malaysia | Online Watch Shop Malaysia,Get the lowest price ❤️ on Ohtsuka Watch, Mens Watches, Rosefield Watches, cheap watches on sale, and more | ✅ Enjoy online shopping and buy Watches Online in Malaysia

Vivo Price List in Philippines for January, 2019,Vivo Price List in Philippines for January, 2019 | iPrice,[January, 2019] The best Vivo price in Philippines starts from ₱ 43.00. Compare top models from Vivo Philippines such as the Vivo V9, and Vivo Y81. Find the cheapest Vivo price list in Philippines, compare specs, reviews, and more at iPrice!
Gaming Price List in Philippines for January, 2019 ,Gaming Price List in Philippines for January, 2019 | iPrice,[January, 2019] The best Gaming price in Philippines starts from ₱ 85.00. Compare top models from the latest Gaming in Philippines, find the cheapest new/second-hand units, read reviews, specifications, and the latest Gaming price list at iPrice!
Beauties Gaming Price List in Philippines for January, 2019,Beauties Gaming Price List in Philippines for January, 2019 | iPrice,[January, 2019] The best Beauties Gaming price in Philippines starts from ₱ 116.00. Compare top models from Beauties Gaming in Philippines, find the cheapest new/second-hand products, read reviews, specifications, and the latest Beauties Gaming price list at iPrice!
Shoes Philippines,Affordable Shoes for Sale Philippines Price List 2019,Get the best Shoes price in the Philippines | Shop Shoes with our discounts & offers.
Shoes for Men,Shoes for Men | The best prices online in Philippines | iPrice,Buy the newest Shoes for Men with the latest sales & promotions ★ Find cheap offers ★ Browse our wide selection of products
Shoes for Men,Shoes for Men | The best prices online in Philippines | iPrice,Buy the newest Shoes for Men with the latest sales & promotions ★ Find cheap offers ★ Browse our wide selection of products
Nintendo 3DS Price in Philippines & Specs,Nintendo 3DS price in Philippines | Compare Reviews, Specs Online.,Compare Nintendo 3DS Price in Philippines from different leading online stores like Lazada, Galleon and Buy Online. Check the features, latest expert reviews, variants & specs of Nintendo 3DS.

Huawei Price in Singapore January, 2019,Huawei Price in Singapore for January, 2019 | iPrice,[January, 2019] The cheapest Huawei price in Singapore starts from S$ 2.40. Compare top models from Huawei Singapore, compare new/second-hand price, the best specs, latest review, and more from iPrice!
Huawei Ascend Price in Singapore January, 2019,Huawei Ascend Price in Singapore for January, 2019 | iPrice,[January, 2019] The cheapest Huawei Ascend price in Singapore starts from S$ 80.00. Compare top models from Huawei Ascend in Singapore, buy new/second-hand units, the best specs, latest review, and more from iPrice!
Black Huawei Ascend,Black Huawei Ascend | The best prices online in Singapore | iPrice,Buy the newest Huawei Ascend in Black with the latest sales & promotions ★ Find cheap offers ★ Browse our wide selection of products
Huawei Mate 20 Pro Price in Singapore & Specifications,Huawei Mate 20 Pro Price in Singapore & Specifications for January, 2019,January, 2019 The latest Huawei Mate 20 Pro price in Singapore starts from S$ 825.00. Compare top cheapest Huawei Mate 20 Pro price in Singapore, check specifications, new/used price list at iPrice.
Chinese New Year,Chinese New Year | The best prices online in Singapore | iPrice,Buy the newest Chinese New Year with the latest sales & promotions ★ Find cheap offers ★ Browse our wide selection of products
Chinese New Year for Women,Chinese New Year for Women | The best prices online in Singapore | iPrice,Buy the newest Chinese New Year for Women with the latest sales & promotions ★ Find cheap offers ★ Browse our wide selection of products
MagiDeal Online Store,MagiDeal Online Store | The best prices online in Singapore | iPrice,Buy the newest MagiDeal products in Singapore with the latest sales & promotions ★ Find cheap offers ★ Browse our wide selection of products

Mua Tai nghe bluetooth Samsung giá rẻ nhất Tháng một 2019,Tai nghe bluetooth Samsung giá rẻ chính hãng,Mua Tai nghe bluetooth Samsung giá rẻ chính hãng cập nhật Tháng một 2019. Tìm kiếm, đánh giá và so sánh giá tốt nhất Samsung Level U, Samsung HM1300, Samsung N7100 Bluetooth Headset.
Giá Samsung Level U và Thông số,Samsung Level U giá rẻ nhất, chính hãng,Mua Samsung Level U giá rẻ chỉ từ 920.000 đ. So sánh giá Samsung Level U chính hãng từ nhiều cửa hàng uy tín, có trả góp!
EOM Việt Nam,EOM Việt Nam,Mua online quần áo EOM, Phòng ngủ EOM, Thiết bị thông minh EOM @Cửa hàng trực tuyến EOM Việt Nam ✓ Mã giảm giá EOM Vietnam ✓ Đổi trả dễ dàng ✓ Thanh toán tiện lợi.
Giá Trang sức Việt Nam,Mua Trang sức giá rẻ nhất | Cập nhật Trang sức khuyến mãi lớn,Cập nhật Trang sức chính hãng 🎯 | Săn coupon giảm đến 97% khi mua hàng!
Giá Trang sức Nam,Mua Trang sức Nam giảm giá | Ưu đãi tốt,So sánh giá Trang sức Nam từ nhà cung cấp AliExpress, cungmua.com 🎯 Trang sức Nam giá rẻ, chất lượng tốt
Trang sức màu Đen cho Nam,Sản phẩm Trang sức màu Đen cho Nam | các ưu đãi giá trực tuyến tốt nhất tại Việt Nam | iPrice,Mua sắm sản phẩm Trang sức màu Đen cho Nam mới ra mắt với chương trình khuyến mãi & ưu đãi mới nhất ★ Tìm kiếm ưu đãi giá rẻ ★ Không giới hạn trong lựa chọn
Trang sức màu Đen cho Nam,Sản phẩm Trang sức màu Đen cho Nam | các ưu đãi giá trực tuyến tốt nhất tại Việt Nam | iPrice,Mua sắm sản phẩm Trang sức màu Đen cho Nam mới ra mắt với chương trình khuyến mãi & ưu đãi mới nhất ★ Tìm kiếm ưu đãi giá rẻ ★ Không giới hạn trong lựa chọn
Giá Trang sức Amour,Amour Việt Nam | Giá Trang sức Amour chính hãng | Khuyến mãi lớn,Cập nhật Trang sức Amour chính hãng | Coupons giảm đến 82% khi mua hàng 🎯