Innisfree Jeju Volcanic Pore Clay Mask	https://p.ipricegroup.com/uploaded_f86fba293723eb39f02ec92374372252.jpg
M.A.C Studio Fix Fluid	https://p.ipricegroup.com/uploaded_6d3f8d741c95edf45ae246bef9c15b7b.jpg
Nature Republic Aloe Vera	https://p.ipricegroup.com/c692f45bc1f1fa4a4b5253544ef9dd9a61c8569f_0.jpg
Bath & Body Works Ultra Shea Body Cream	https://p.ipricegroup.com/uploaded_3a5b900564294f382cf75e9d22a737dc.jpg
Colourpop Ultra Matte Lip	https://p.ipricegroup.com/uploaded_2545f649188cee61d3de47979b810053.jpg
Fresh Black Tea Firming Overnight Mask	https://p.ipricegroup.com/80f9b55445f6bbae349be595a1e674034cc6b518_0.jpg
Innisfree Jeju Volcanic Pore Cleansing Foam	https://p.ipricegroup.com/28aa3ee0e7758447221a0505ef9ab6b68df1c04d_0.jpg
Innisfree No Sebum Mineral Powder	https://p.ipricegroup.com/uploaded_c8b566f4553886ff5284bc16a27011a6.jpg
Innisfree Vivid Cotton Ink	https://p.ipricegroup.com/c942bf8f58db742da966e049fafe3e124780201e_0.jpg
Kiehl's Creamy Eye Treatment with Avocado	https://p.ipricegroup.com/863ca8267621c009ffd9b1750b63b98e860467f0_0.jpg